{
  "event_id": "aa5150ea-f44f-410d-b165-1e06a7bd2205",
  "event_type": "lot.changed",
  "schema_version": 1,
  "occurred_at": "2026-09-24T08:00:00.000000Z",
  "tenant_id": "11111111-1111-4111-8111-111111111111",
  "aggregate_type": "bin_occupancy",
  "aggregate_id": "55555555-5555-4555-8555-555555555555",
  "aggregate_version": "1",
  "correlation_id": "4d9d9d30-d209-446e-99ea-d40ab0953d0d",
  "causation_id": "0d72ff07-a646-4d41-9b5b-52c5f25e4ca8",
  "traceparent": "00-4bf92f3577b34da6a3ce929d0e0e4736-00f067aa0ba902b7-01",
  "payload": {
    "bin_id": "55555555-5555-4555-8555-555555555555",
    "site_id": "22222222-2222-4222-8222-222222222222",
    "lot_id": "77777777-7777-4777-8777-777777777777",
    "grain_type": "wheat",
    "variety": "spring",
    "occupancy_version": "1",
    "effective_from": "2026-09-24T08:00:00.000Z",
    "previous_lot_id": null
  }
}
